codigo_producto,nombre,descripcion_original,descripcion_mejorada,alias_propuestos,accion
89090126,Spinach Chopped Box 36lb (12x3lb),"Descubre el Spinach Chopped Box de 36 lb (12x3 lb), la elección perfecta para quienes buscan frescura y versatilidad. Este producto premium de espinacas picadas es ideal para ensaladas, guisos y smoothies, garantizando un sabor vibrante y nutritivo. Ofrecido en un formato práctico de 12 bolsas de 3 lb, facilita su almacenamiento y uso en tu negocio. Además, su alta demanda impulsa la rotación, atrayendo a clientes que aprecian lo saludable. ¡Aprovecha este must-have en tu mostrador!","Espinaca picada IQF en caja de 36 lb (12 bolsas de 3 lb cada una), preparada a partir de espinaca fresca, limpia y sana, sometida a un proceso de clasificación, lavado, blanqueado y congelación rápida para facilitar la porcionabilidad y aumentar el rendimiento.",espinaca|spinach,ACTUALIZAR
736952201768,French whole GREEN BEANS 22 lb,"Descubre la frescura y sabor inigualable de nuestras French Whole Green Beans de 22 lb, el acompañamiento perfecto para cualquier plato. Este formato económico garantiza que siempre tengas suficiente para atender a tus clientes. Con su textura crujiente y vibrante color, se convierten en un atractivo irresistible para la compra por impulso. Su versatilidad en la cocina atraerá a un amplio público, asegurando una rotación rápida y un margen de ganancia atractivo para tu negocio. ¡No dejes pasar esta oportunidad!","Frijoles verdes enteros congelados, presentados en bolsa de 22 lb, ideales para uso en cocina profesional o doméstica, sin aditivos ni conservantes, con textura crujiente y color vibrante.",ejotes|habichuelas verdes|frijoles verdes,ACTUALIZAR
89090082,Pineapple chunk frozen 20 lb,"¡Descubre la frescura tropical con nuestros Pineapple Chunk Frozen de 20 lb! Perfectos para batidos, postres o como un snack refrescante, estos trozos de piña congelada son irresistibles tanto para los amantes de la fruta como para los chefs creativos. Cada caja contiene 20 lb, ideal para satisfacer la demanda de tus clientes. Su presentación en grandes formatos asegura una rotación rápida, aumentando tus márgenes y estimulando las compras por impulso. ¡No dejes pasar esta oportunidad de sumar un producto delicioso a tu mostrador!","Fruta congelada tipo trozos de piña, empaquetada en bolsa de 20 lb, IQF, elaborada a partir de piñas frescas y maduras, cortadas en trozos y congeladas individualmente para preservar su calidad y textura.",piña|trozos de piña|chunk de piña,ACTUALIZAR
10855006006016,ACAI TROPICAL organic packs 3.5 oz (NO SUGAR),"Descubre el irresistible sabor de los packs de 3.5 oz de ACAI TROPICAL, ¡sin azúcar añadido! Este superalimento orgánico es la tendencia perfecta para quienes buscan opciones saludables y refrescantes. Cada exhibidor contiene 12 unidades, ideal para mantener en tu kiosco o almacén. Su atractivo natural y nutritivo garantiza compras por impulso, especialmente entre los amantes del bienestar. Aumenta tu margen de ganancia y atrae a un público consciente de su salud con este delicioso producto. ¡Impulsa tus ventas hoy!","Pulpa de açaí orgánica en formato de empaque de 3.5 oz, sin azúcar añadido, ideal para preparar smoothies o bowls. Producto de origen brasileño, rico en antioxidantes y nutrientes.",açaí|pulpa de açaí,ACTUALIZAR
89090055,Cut Okra 24 lb,"Descubre el Cut Okra 24 lb, la opción perfecta para tus clientes que buscan un sabor auténtico y saludable. Este formato de 24 libras es ideal para almacenes y kioscos que desean ofrecer productos frescos y versátiles. Su presentación en bolsa facilita la venta y almacenamiento. Además, su popularidad entre quienes buscan alternativas nutritivas asegura una alta rotación y un excelente margen de ganancia. ¡Aprovecha la tendencia saludable y añade el Cut Okra a tu oferta hoy mismo!","Quingombó (okra) cortado congelado IQF, presentación de 24 lb, ideal para guisos, frituras y cocina sureña/latina.",quingombó|okra|gombo,ACTUALIZAR
861272000194,COCONUT EXOTIC SCOOP 3GAL,"Descubre el sabor tropical con COCONUT EXOTIC SCOOP 3GAL, el helado de coco que atraerá a tus clientes en cada visita. Presentado en un práctico formato de 3 galones, ideal para servir en porciones generosas. Este producto no solo es delicioso, sino que también garantiza una alta rotación en tu negocio gracias a su atractivo para el público joven y las familias. Aumenta tus ventas impulsivas y disfruta de un excelente margen de ganancia con cada bola servida.","Sorbet de coco orgánico de 3 galones, elaborado con crema de coco, jarabe de arroz orgánico y azúcar de caña orgánica, con un sabor tropical y cremoso, ideal para preparar bowls y smoothies.",sorbete de coco|sorbete|coco,ACTUALIZAR
736952201706,"Mix Tropical frozen 0,75lb BENFRESH","Descubre el irresistible sabor del Mix Tropical frozen 0,75lb de BENFRESH, la opción perfecta para quienes buscan frescura y calidad en cada bocado. Este atractivo formato trae 12 paquetes de 0,75 lb, ideales para exhibir en tu mostrador. Su combinación exótica de frutas congeladas es perfecta para smoothies, postres o snacks saludables. Ofrece un alto margen de ganancia y es un producto que invita a la compra por impulso, atrayendo a un público que valora lo natural y delicioso. ¡Dale un giro fresco a tu negocio!","Mezcla tropical congelada de frutas, presentada en bolsa de 0,75 lb, marca Benfresh, que incluye una variedad de frutas tropicales seleccionadas y congeladas para preservar su frescura y nutrientes.",mezcla de frutas|frutas tropicales congeladas|frutas congeladas,ACTUALIZAR
736952201973,Strawberry frozen 3lb BENFRESH-Box 24 lb (8x3lb),"Descubre la frescura irresistible de las fresas congeladas Benfresh, ideales para smoothies, postres y más. Presentadas en una caja de 24 lb, que incluye 8 bolsas de 3 lb cada una, son perfectas para abastecer tu negocio. Este producto no solo atrae a los amantes de la fruta, sino que su formato facilita la rotación rápida, ideal para compras por impulso. Aumenta tus márgenes y satisface la demanda de tus clientes con esta deliciosa opción en tu mostrador.","Frutilla congelada IQF marca Benfresh, presentada en cajas de 24 lb (8 bolsas de 3 lb cada una), ideal para uso en repostería y heladería, manteniendo frescura y sabor del producto original.",frutilla|fresa,ACTUALIZAR
20001,BOX 16 X 12 X 8 RAINFOREST,"Descubre la frescura y el sabor exótico de BOX 16 X 12 X 8 RAINFOREST, una experiencia única que atraerá a tus clientes. Este formato incluye 12 displays, cada uno con 16 unidades, ideal para exhibir en tu kiosco o almacén. Su atractivo diseño y variedad de sabores aseguran una compra por impulso, maximizando tu margen de ganancia. Perfecto para aquellos que buscan una opción refrescante y saludable. No dejes pasar la oportunidad de aumentar la rotación en tu negocio.","Caja de cartón corrugado para packaging, dimensiones 16 x 12 x 8 pulgadas, línea Rainforest. Material de embalaje, no es un producto alimenticio.",caja de cartón|box packaging|embalaje,ACTUALIZAR
89090016,Edamame frozen 22lb,"Descubre el delicioso Edamame Frozen de 22 lb, la tendencia saludable que encanta a todos. Perfecto como snack o acompañante, este producto ofrece un sabor fresco y auténtico que atraerá a tus clientes. Presentado en un práctico formato de 22 lb, ideal para tiendas de conveniencia y almacenes. Su alta demanda y versatilidad garantizan una excelente rotación y un atractivo margen de ganancia. ¡No dejes pasar la oportunidad de satisfacer a tus clientes con este snack irresistible!","Edamame congelado en presentación de 22 lb, compuesto por vainas de soja verde, ideal para su uso en platos asiáticos o como snack. Producto importado, listo para cocinar o consumir, con un proceso de congelación que preserva su frescura.",soja verde|edamame,ACTUALIZAR
89090128,Spinach chopped 30 lb,"¡Descubre el sabor fresco y versátil de nuestro Spinach Chopped de 30 lb! Ideal para ensaladas, smoothies o guisos, este espinaca picada es el aliado perfecto en la cocina. Presentado en un formato conveniente de 30 libras, asegurando que siempre tengas la cantidad justa a mano. Su alta demanda en el mercado y su atractivo para aquellos que buscan opciones saludables garantizan una rotación rápida. Atrae a tus clientes con un producto que impulsa las ventas y maximiza tu rentabilidad.","Espinaca picada congelada, presentada en bolsa de 30 lb, ideal para la preparación de guisos, salteados y acompañamientos saludables. Producto IQF, listo para cocinar en minutos.",espinaca|spinach,ACTUALIZAR
89090043,BLUE MAGIC TROPICAL Sorbet 3 gal,"¡Descubre el refrescante sabor de BLUE MAGIC TROPICAL Sorbet! Este delicioso sorbete de 3 galones es la opción perfecta para los días calurosos y atraer a los amantes de lo dulce y exótico. Presentado en un formato ideal para kioscos y almacenes, cada unidad es fácil de manejar y almacenar. Su atractivo sabor y textura suave garantizan una rápida rotación, impulsando las compras por impulso. ¡Aumenta tus ganancias y ofrece a tus clientes una experiencia refrescante que no podrán resistir!","Sorbet de frutas tropicales de 3 galones, elaborado con ingredientes premium como pulpa de piña y fibra prebiótica, ideal para máquinas de batidos y helados. Producto listo para usar, sabor exótico de frutas tropicales.",sorbete|sorbete de piña|sorbete tropical,ACTUALIZAR
89090089,Celery frozen 20 lb,"Descubre la frescura y versatilidad del Celery Frozen de 20 lb, el complemento perfecto para tus platillos. Este formato económico incluye 20 libras de apio congelado, ideal para mantener en stock y ofrecer a tus clientes una opción saludable y sabrosa. Su presentación en bolsa facilita el manejo y almacenamiento. Al estar en el mostrador, atrae a consumidores que buscan conveniencia y calidad, garantizando rotación rápida y márgenes atractivos. ¡Aprovecha esta oportunidad y potencia tus ventas!","Apio congelado en presentación de 20 lb, cortado en tiras, ideal para uso en sopas, guisos y ensaladas. Producto IQF, manteniendo frescura y nutrientes.",apio|celery,ACTUALIZAR
736952201799,Pepper 3 Color Slice 1lb,"Descubre el irresistible sabor de los Pepper 3 Color Slice, un producto que encantará a tus clientes con su vibrante mezcla de colores y frescura. Presentado en un práctico formato de 12 displays de 1 libra cada uno, es ideal para exhibir en tu mostrador. Este producto no solo atrae la atención, sino que también impulsa las compras por impulso, ofreciendo un excelente margen de ganancia. Perfecto para quienes buscan calidad y variedad en su dieta diaria. ¡Aumenta tus ventas hoy!","Mezcla de pimientos rojos, verdes y amarillos en rodajas, congelados IQF, presentados en bolsa de 1 lb. Ideal para su uso en ensaladas, guisos y platos variados, manteniendo frescura y sabor.",pimientos|pimientos en rodajas|pimientos morrones|pimientos congelados,ACTUALIZAR
89090088,Red & Green Pepper Strips Mix 25 lb,"Descubre la explosión de sabor que ofrece el Red & Green Pepper Strips Mix de 25 lb, ideal para añadir un toque vibrante a tus platillos. Este formato, que incluye 12 bolsas, es perfecto para mantener la frescura y calidad en cada porción. Su colorido atractivo garantiza que tus clientes no puedan resistirse a un producto tan versátil y saludable. Aumenta la rotación en tu tienda: ideal para ensaladas, guisos y como opción saludable de compra por impulso. ¡Hazlo parte de tu oferta!","Mezcla congelada IQF de tiras de pimientos rojos y verdes, presentación de 25 lb, ideal para fajitas, salteados y preparaciones industriales.",pimientos|tiras de pimiento|pimientos rojos|pimientos verdes|pepper strips,ACTUALIZAR
736952201669,Onion Diced,"Descubre el sabor irresistible de Onion Diced, la opción perfecta para realzar cualquier platillo. Este producto viene en un práctico formato de 12 displays de 48 unidades, ideal para mantener siempre frescos y listos los ingredientes en tu negocio. Su fácil uso y versatilidad lo convierten en un favorito para chefs y cocineros caseros. Aumenta tus ventas con este producto de alta rotación que atrae la compra por impulso, asegurando un margen atractivo y un público siempre dispuesto a probar.","Cebolla picada, cortada en cubos, ideal para cocinar o añadir a ensaladas. Presentación en bolsa de 1 kg, con sabor fresco y textura crujiente, adecuada para diversas preparaciones culinarias.",cebolla picada|cebolla en cubos|cebolla troceada,ACTUALIZAR
736952201690,Mix Tropical frozen 3lb BENFRESH-Box 24 lb (8x3lb),"Descubre el irresistible Mix Tropical de BENFRESH, una explosión de sabores exóticos que hará vibrar a tus clientes. Cada caja contiene 8 bolsas de 3 lb, perfectas para satisfacer cualquier antojo. Ideal para smoothies, postres o simplemente disfrutar al natural, este producto se convierte en una opción perfecta para el verano. Su atractivo precio y alta rotación garantizan un excelente margen de ganancia. No dejes pasar la oportunidad de incrementar tus ventas con este must-have en tu mostrador.","Mezcla tropical congelada de frutas, presentada en caja de 24 lb (8 bolsas de 3 lb cada una), marca Benfresh, compuesta por una variedad de frutas seleccionadas y congeladas para preservar su frescura y nutrientes.",mezcla de frutas|frutas congeladas|mix de frutas,ACTUALIZAR
