nombre,zone_type,description,color,dia_visita,codigo_ruta,vendedor_idx,geometry_wkt,is_mock
ZONA NORTE - Recreo,sales,"Zona comercial Recreo, acceso por Av. San Martín.",#E74C3C,lunes,R01-A,0,"SRID=4326;MULTIPOLYGON(((-71.541528 -33.043867999999996, -71.532293 -33.043867999999996, -71.532293 -33.035356, -71.541528 -33.035356, -71.541528 -33.043867999999996)))",true
ZONA SUR - Gómez Carreño,sales,"Zona comercial Gómez Carreño, acceso por Av. Valparaíso.",#3498DB,martes,R02-A,1,"SRID=4326;MULTIPOLYGON(((-71.556598 -33.025234999999995, -71.547166 -33.025234999999995, -71.547166 -33.016509, -71.556598 -33.016509, -71.556598 -33.025234999999995)))",true
ZONA ESTE - Viña del Mar Centro,sales,"Zona comercial Viña del Mar Centro, acceso por Av. Libertad.",#F1C40F,miercoles,R03-A,2,"SRID=4326;MULTIPOLYGON(((-71.543652 -33.026663, -71.535916 -33.026663, -71.535916 -33.018242, -71.543652 -33.018242, -71.543652 -33.026663)))",true
ZONA OESTE - El Salto,sales,"Zona comercial El Salto, acceso por Av. El Salto.",#9B59B6,jueves,R04-A,0,"SRID=4326;MULTIPOLYGON(((-71.571223 -33.034155999999996, -71.56245200000001 -33.034155999999996, -71.56245200000001 -33.025685, -71.571223 -33.025685, -71.571223 -33.034155999999996)))",true
ZONA NORESTE - Playa Ancha,sales,"Zona comercial Playa Ancha, acceso por Av. Playa Ancha.",#E67E22,viernes,R05-A,1,"SRID=4326;MULTIPOLYGON(((-71.543626 -33.018995, -71.537038 -33.018995, -71.537038 -33.010407, -71.543626 -33.010407, -71.543626 -33.018995)))",true
ZONA SUROESTE - Forestal,sales,"Zona comercial Forestal, acceso por Av. Forestal.",#1ABC9C,sabado,R06-A,2,"SRID=4326;MULTIPOLYGON(((-71.562234 -33.032568, -71.554415 -33.032568, -71.554415 -33.025131, -71.562234 -33.025131, -71.562234 -33.032568)))",true
