base_product_code,related_product_code,reason,is_mock
29003,29011,Llevá el formato familiar de Coca-Cola Original de 1.5L para mayor ahorro,True
29011,29012,Llevá el formato extra grande de Coca-Cola Original de 2.25L,True
29012,29016,Llevá el formato familiar gigante de Coca-Cola Original de 2.5L,True
29010,29015,Llevá el formato familiar extra grande de Coca-Cola Zero de 2.25L,True
29049,29057,Llevá el formato grande de Fanta Naranja de 2.25L para compartir,True
29045,29047,Llevá el formato grande de Sprite Lima-Limón de 2.25L para eventos,True
29188,29194,Llevá el formato grande de Agua Bonaqua Sin Gas de 1.5L para hidratarte todo el día,True
29228,29229,Llevá el formato familiar de Aquarius Naranja de 2.25L para compartir,True
