base_product_code,related_product_code,reason,is_mock
LYL-0005,LYL-0004,Opta por la gaseosa Secco de 1.5L en lugar de la de 500cc para disfrutar más.,true
LYL-0011,LYL-0017,Elige la chocolatada Mr. Choco de 1L en vez de la de 200cc para más sabor.,true
LYL-0024,LYL-0026,El pack de 12 latas XL de Speed es una mejor opción que el pack de 24 latas de 250cc.,true
LYL-0040,LYL-0041,Elige el Fernet Branca de 1L en lugar del de 750cc para disfrutar más de tu bebida.,true
LYL-0051,LYL-0050,Opta por el vino Elementos Malbec de 750cc en vez del vino Los Árboles para una experiencia superior.,true
LYL-0241,LYL-0246,Elige las galletas Vocación Clásica de 384g en lugar de las de 141g para más porción.,true
LYL-0274,LYL-0273,Opta por las tostadas saladas de 1kg en lugar de las de 200g para tener más cantidad.,true
LYL-0281,LYL-0280,Elige el arroz María de 1kg en lugar del de 500g para tener más para tus comidas.,true
LYL-0295,LYL-0296,Opta por la leche descremada de 800g en lugar de la entera para una opción más ligera.,true
